{
  "$schema": "https://json-schema.org/draft/2020-12/schema",
  "$id": "https://chameleon-ui.dev/schemas/component-contract/v0.2.json",
  "title": "Chameleon UI Component Contract v0.2",
  "description": "Machine-readable semantic contract generated from a component source directory. v0.2 registers the project key names as canonical (see chameleon-ui/docs/ai/component-contract-v0.2-mapping.md) and makes dataAi.state/intent vocabulary mandatory.",
  "type": "object",
  "additionalProperties": false,
  "required": [
    "schemaVersion",
    "slug",
    "name",
    "status",
    "purpose",
    "scenarios",
    "props",
    "variants",
    "states",
    "composition",
    "antiPatterns",
    "a11y",
    "responsive",
    "platforms",
    "rtl",
    "dataAi"
  ],
  "properties": {
    "schemaVersion": {
      "const": "0.2",
      "description": "Schema version, independent from the component package version."
    },
    "slug": { "$ref": "#/$defs/slug" },
    "name": { "type": "string", "minLength": 1, "maxLength": 80 },
    "family": {
      "type": "string",
      "enum": ["A", "B", "C", "D", "E", "F", "G", "H"],
      "description": "Component family per vision v3.0 section 7.2; required on Phase 6+ additions, optional on earlier contracts."
    },
    "status": {
      "type": "string",
      "enum": ["draft", "experimental", "stable", "deprecated"]
    },
    "purpose": {
      "type": "string",
      "minLength": 10,
      "maxLength": 500
    },
    "scenarios": {
      "type": "array",
      "minItems": 1,
      "uniqueItems": true,
      "items": { "type": "string", "minLength": 3, "maxLength": 160 }
    },
    "props": {
      "type": "object",
      "propertyNames": { "$ref": "#/$defs/memberName" },
      "additionalProperties": { "$ref": "#/$defs/prop" }
    },
    "variants": {
      "type": "array",
      "items": { "$ref": "#/$defs/variant" }
    },
    "states": {
      "type": "array",
      "uniqueItems": true,
      "items": { "$ref": "#/$defs/state" }
    },
    "composition": { "$ref": "#/$defs/composition" },
    "antiPatterns": {
      "type": "array",
      "uniqueItems": true,
      "items": { "type": "string", "minLength": 5, "maxLength": 240 }
    },
    "a11y": { "$ref": "#/$defs/a11y" },
    "responsive": { "$ref": "#/$defs/responsive" },
    "platforms": { "$ref": "#/$defs/platforms" },
    "rtl": { "$ref": "#/$defs/rtl" },
    "dataAi": { "$ref": "#/$defs/dataAi" },
    "telemetry": { "$ref": "#/$defs/telemetry" },
    "mechanics": {
      "type": "string",
      "minLength": 20,
      "maxLength": 2000,
      "description": "How the component works: morph, state, and pairing rules. Optional; docs synthesize from purpose + responsive when omitted."
    },
    "usage": {
      "type": "array",
      "minItems": 1,
      "uniqueItems": true,
      "items": { "type": "string", "minLength": 10, "maxLength": 400 },
      "description": "Ordered usage steps. Optional; docs synthesize from required props and scenarios when omitted."
    },
    "exports": {
      "type": "array",
      "minItems": 1,
      "items": { "$ref": "#/$defs/exportEntry" },
      "description": "Public package exports (component, hooks, helpers, types)."
    }
  },
  "$defs": {
    "slug": {
      "type": "string",
      "pattern": "^[a-z][a-z0-9]*(?:-[a-z0-9]+)*$",
      "maxLength": 80
    },
    "memberName": {
      "type": "string",
      "pattern": "^[a-z][A-Za-z0-9]*$",
      "maxLength": 80
    },
    "stringList": {
      "type": "array",
      "uniqueItems": true,
      "items": { "type": "string", "minLength": 1, "maxLength": 120 }
    },
    "prop": {
      "type": "object",
      "additionalProperties": false,
      "required": ["type", "required", "description"],
      "properties": {
        "type": {
          "type": "string",
          "enum": ["string", "number", "boolean", "enum", "node", "event"]
        },
        "required": { "type": "boolean" },
        "description": { "type": "string", "minLength": 3, "maxLength": 240 },
        "values": {
          "type": "array",
          "minItems": 1,
          "uniqueItems": true,
          "items": {
            "anyOf": [
              { "type": "string" },
              { "type": "number" },
              { "type": "boolean" }
            ]
          }
        },
        "default": {
          "anyOf": [
            { "type": "string" },
            { "type": "number" },
            { "type": "boolean" },
            { "type": "null" }
          ]
        },
        "payload": {
          "type": "string",
          "minLength": 3,
          "maxLength": 160,
          "description": "Event handler signature, e.g. (value: string) => void. Meaningful when type is event."
        }
      },
      "allOf": [
        {
          "if": { "properties": { "type": { "const": "enum" } }, "required": ["type"] },
          "then": {
            "properties": { "values": true },
            "required": ["values"]
          },
          "else": {
            "properties": { "values": false }
          }
        }
      ]
    },
    "variant": {
      "type": "object",
      "additionalProperties": false,
      "required": ["name", "values", "default"],
      "properties": {
        "name": { "$ref": "#/$defs/memberName" },
        "values": {
          "type": "array",
          "minItems": 1,
          "maxItems": 8,
          "uniqueItems": true,
          "items": { "$ref": "#/$defs/slug" }
        },
        "default": { "$ref": "#/$defs/slug" },
        "description": { "type": "string", "minLength": 3, "maxLength": 240 }
      }
    },
    "state": {
      "type": "object",
      "additionalProperties": false,
      "required": ["name", "description"],
      "properties": {
        "name": { "$ref": "#/$defs/slug" },
        "description": { "type": "string", "minLength": 3, "maxLength": 240 }
      }
    },
    "composition": {
      "type": "object",
      "additionalProperties": false,
      "required": ["allowedParents", "allowedChildren", "requiredContext"],
      "properties": {
        "allowedParents": { "$ref": "#/$defs/stringList" },
        "allowedChildren": { "$ref": "#/$defs/stringList" },
        "requiredContext": { "$ref": "#/$defs/stringList" }
      }
    },
    "a11y": {
      "type": "object",
      "additionalProperties": false,
      "required": ["role", "keyboard", "focus", "labeling"],
      "properties": {
        "role": { "type": "string", "minLength": 1, "maxLength": 80 },
        "keyboard": { "$ref": "#/$defs/stringList" },
        "focus": { "type": "string", "minLength": 3, "maxLength": 300 },
        "labeling": { "type": "string", "minLength": 3, "maxLength": 300 },
        "wcag": {
          "type": "array",
          "uniqueItems": true,
          "items": { "type": "string", "pattern": "^[1-4]\\.[0-9]+\\.[0-9]+$" }
        }
      }
    },
    "responsive": {
      "type": "object",
      "additionalProperties": false,
      "required": ["strategy", "breakpoints"],
      "properties": {
        "strategy": { "type": "string", "minLength": 3, "maxLength": 240 },
        "breakpoints": {
          "type": "object",
          "additionalProperties": false,
          "properties": {
            "compact": { "type": "string", "minLength": 3, "maxLength": 240 },
            "medium": { "type": "string", "minLength": 3, "maxLength": 240 },
            "large": { "type": "string", "minLength": 3, "maxLength": 240 }
          }
        }
      }
    },
    "supportLevel": {
      "type": "string",
      "enum": ["supported", "planned", "not-applicable"]
    },
    "platforms": {
      "type": "object",
      "additionalProperties": false,
      "required": ["web", "react", "vue"],
      "properties": {
        "web": { "$ref": "#/$defs/supportLevel" },
        "react": { "$ref": "#/$defs/supportLevel" },
        "vue": { "$ref": "#/$defs/supportLevel" }
      }
    },
    "rtl": {
      "type": "object",
      "additionalProperties": false,
      "required": ["supported", "strategy"],
      "properties": {
        "supported": { "type": "boolean" },
        "strategy": { "type": "string", "minLength": 3, "maxLength": 240 },
        "mirroredValues": { "$ref": "#/$defs/stringList" }
      }
    },
    "exportEntry": {
      "type": "object",
      "additionalProperties": false,
      "required": ["name", "kind", "signature", "description"],
      "properties": {
        "name": {
          "type": "string",
          "pattern": "^[A-Za-z_][A-Za-z0-9]*$",
          "maxLength": 80
        },
        "kind": {
          "type": "string",
          "enum": ["component", "hook", "function", "type"]
        },
        "signature": { "type": "string", "minLength": 3, "maxLength": 240 },
        "description": { "type": "string", "minLength": 3, "maxLength": 240 }
      }
    },
    "dataAi": {
      "description": "Static Agent-readable markers mirrored to data-ai-* DOM attributes; this does not emit telemetry. v0.2: role/states/intents are all required; intents must be registered in chameleon-ui/docs/ai/data-ai-vocabulary.md.",
      "type": "object",
      "additionalProperties": false,
      "required": ["role", "states", "intents"],
      "properties": {
        "role": { "$ref": "#/$defs/slug" },
        "states": {
          "type": "array",
          "minItems": 1,
          "uniqueItems": true,
          "items": { "type": "string", "minLength": 1, "maxLength": 120 }
        },
        "intents": {
          "type": "array",
          "minItems": 1,
          "uniqueItems": true,
          "items": { "type": "string", "minLength": 1, "maxLength": 120 }
        }
      }
    },
    "telemetry": {
      "description": "Phase 1 hook-name reservation only; validation never sends events.",
      "type": "object",
      "additionalProperties": false,
      "required": ["hooks"],
      "properties": {
        "hooks": {
          "type": "array",
          "uniqueItems": true,
          "items": { "$ref": "#/$defs/slug" }
        }
      }
    }
  }
}
