{
  "schemaVersion": "0.2",
  "slug": "description-list",
  "name": "DescriptionList",
  "status": "experimental",
  "purpose": "Presents a list of term-description pairs.",
  "scenarios": [
    "Show product metadata",
    "Display key-value pairs",
    "Render a definition list"
  ],
  "props": {
    "items": {
      "type": "string",
      "required": true,
      "description": "Array of {term, description} items."
    },
    "className": {
      "type": "string",
      "required": false,
      "description": "Additional CSS classes."
    }
  },
  "variants": [],
  "states": [
    {
      "name": "default",
      "description": "List rendered."
    }
  ],
  "composition": {
    "allowedParents": [
      "card",
      "page",
      "form"
    ],
    "allowedChildren": [],
    "requiredContext": []
  },
  "antiPatterns": [
    "Do not use for layout tables.",
    "Do not use when a regular table is more appropriate."
  ],
  "a11y": {
    "role": "list",
    "keyboard": [],
    "focus": "Not focusable.",
    "labeling": "Terms are labelled by their dt element.",
    "wcag": [
      "1.3.1"
    ]
  },
  "responsive": {
    "strategy": "Single column by default; may be styled into columns externally.",
    "breakpoints": {
      "compact": "Single column.",
      "medium": "Single column.",
      "large": "Single column."
    }
  },
  "platforms": {
    "web": "supported",
    "react": "supported",
    "vue": "planned"
  },
  "rtl": {
    "supported": true,
    "strategy": "Logical CSS only.",
    "mirroredValues": []
  },
  "dataAi": {
    "role": "description-list",
    "states": [
      "default"
    ],
    "intents": [
      "inspect-details"
    ]
  }
}
