{
  "schemaVersion": "0.2",
  "slug": "masonry",
  "name": "Masonry",
  "family": "A",
  "status": "experimental",
  "purpose": "Arranges uneven-height children into responsive CSS columns without a fixed row grid.",
  "scenarios": [
    "Display a gallery of mixed-height cards",
    "Present a Pinterest-style content feed",
    "Pack dashboard widgets of varying height"
  ],
  "props": {
    "children": {
      "type": "node",
      "required": true,
      "description": "Items packed into columns."
    },
    "columns": {
      "type": "number",
      "required": false,
      "description": "Column count used at the large breakpoint (2, 3, or 4).",
      "default": 3
    },
    "gap": {
      "type": "enum",
      "required": false,
      "description": "Column gap token.",
      "values": ["sm", "md", "lg"],
      "default": "md"
    },
    "className": {
      "type": "string",
      "required": false,
      "description": "Additional CSS classes."
    }
  },
  "variants": [
    {
      "name": "gap",
      "values": ["sm", "md", "lg"],
      "default": "md",
      "description": "Column gap token."
    }
  ],
  "states": [
    {
      "name": "default",
      "description": "Columns follow the container query morph."
    }
  ],
  "composition": {
    "allowedParents": ["container", "app-shell", "page"],
    "allowedChildren": ["card", "image", "article-card"],
    "requiredContext": []
  },
  "antiPatterns": [
    "Do not use Masonry for tabular data; use Table or DataGrid.",
    "Do not force equal-height rows; that is Grid."
  ],
  "a11y": {
    "role": "generic",
    "keyboard": [],
    "focus": "Children remain focusable in source order, which may not match visual column order.",
    "labeling": "Children provide their own labels.",
    "wcag": ["1.3.1", "1.3.2"]
  },
  "responsive": {
    "strategy": "Root is a query container. Compact is one column; tablet is two; desktop uses the columns prop (3 or 4). No viewport size media.",
    "breakpoints": {
      "compact": "One column.",
      "medium": "Two columns at 48rem container width.",
      "large": "Three or four columns at 80rem container width."
    }
  },
  "platforms": {
    "web": "supported",
    "react": "supported",
    "vue": "planned"
  },
  "rtl": {
    "supported": true,
    "strategy": "Logical CSS only. CSS columns follow document direction.",
    "mirroredValues": []
  },
  "dataAi": {
    "role": "masonry",
    "states": ["default"],
    "intents": ["layout-columns"]
  }
}
